{"schema_version":"1.0","scenario_id":"f01-lost-update-repaired","pair_id":"F01","variant":"repaired","seed":8001,"initial_state":{"completed_exposures":0},"invariants":[{"id":"INV-COUNT","type":"equals","key":"completed_exposures","value":2}],"transactions":[{"id":"T1","reads":["completed_exposures"],"writes":{"completed_exposures":"read+1"}},{"id":"T2","reads":["completed_exposures"],"writes":{"completed_exposures":"read+1"}}],"schedule":["T1:read","T2:read","T1:write","T2:write","T1:commit","T2:commit"],"control":{"isolation":"strict_2pl","atomic_workflow":true,"lock_order":"canonical","retry_scope":"transaction","flush_before_ack":true,"validate_restore":true,"rebuild_derived":true},"fault":{"type":"lost_update"},"prediction":"A write lock or version check serializes the increments and preserves both exposures.","evidence_boundary":"The controlled schedule demonstrates the repair only in this toy engine."}
