{"schema_version":"1.0","scenario_id":"f02-write-skew-repaired","pair_id":"F02","variant":"repaired","seed":8002,"initial_state":{"certified_controllers":2},"invariants":[{"id":"INV-CONTROLLER","type":"min","key":"certified_controllers","value":1}],"transactions":[{"id":"T1","reads":["controller_a","controller_b"],"writes":{"controller_a":"off"}},{"id":"T2","reads":["controller_a","controller_b"],"writes":{"controller_b":"off"}}],"schedule":["T1:snapshot","T2:snapshot","T1:deactivate-a","T2:deactivate-b","T1:commit","T2:commit"],"control":{"isolation":"serializable","atomic_workflow":true,"lock_order":"predicate","retry_scope":"transaction","flush_before_ack":true,"validate_restore":true,"rebuild_derived":true},"fault":{"type":"write_skew"},"prediction":"Serializable validation rejects one dependency cycle and a full retry retains one controller.","evidence_boundary":"The result models serializable validation; vendor abort behavior may differ."}
