{"schema_version":"1.0","scenario_id":"f03-deadlock-repaired","pair_id":"F03","variant":"repaired","seed":8003,"initial_state":{"completed_transfers":0},"invariants":[{"id":"INV-TRANSFERS","type":"equals","key":"completed_transfers","value":2}],"transactions":[{"id":"T1","reads":["telescope_a","telescope_b"],"writes":{"telescope_a":"T1","telescope_b":"T1"}},{"id":"T2","reads":["telescope_b","telescope_a"],"writes":{"telescope_b":"T2","telescope_a":"T2"}}],"schedule":["T1:lock-a","T2:lock-b","T1:wait-b","T2:wait-a","detector:abort-T2","T1:commit"],"control":{"isolation":"strict_2pl","atomic_workflow":true,"lock_order":"canonical","retry_scope":"transaction","flush_before_ack":true,"validate_restore":true,"rebuild_derived":true},"fault":{"type":"deadlock"},"prediction":"Canonical acquisition prevents the cycle; a bounded full retry safely completes the victim workflow.","evidence_boundary":"The retry proof is scoped to deterministic, idempotent Northstar operations."}
