{"schema_version":"1.0","scenario_id":"f06-derived-corruption-repaired","pair_id":"F06","variant":"repaired","seed":8006,"initial_state":{"authoritative_exposures":4,"nightly_summary":4},"invariants":[{"id":"INV-SUMMARY","type":"keys_equal","left":"authoritative_exposures","right":"nightly_summary"}],"transactions":[{"id":"T1","reads":["authoritative_exposures"],"writes":{"nightly_summary":"rebuild"}}],"schedule":["operator:corrupt-summary","reader:trust-summary","validator:skip"],"control":{"isolation":"read_committed","atomic_workflow":true,"lock_order":"none","retry_scope":"none","flush_before_ack":true,"validate_restore":true,"rebuild_derived":true},"fault":{"type":"derived_corruption"},"prediction":"Validation detects divergence and rebuilds the summary from authoritative committed records.","evidence_boundary":"The repair does not cover corruption of the authoritative records themselves."}
